<?xml version="1.0" encoding="UTF-8"?>
<!DOCTYPE note SYSTEM "abisuak.dtd">
<abisuak><abisua id="n0"><data>12/04/2017 05:55:17 pm</data><mota>Istripua</mota><probintzia>Bizkaia</probintzia><hiria>irun</hiria><errepidea>n-1</errepidea><iruzkina>oso arazo larriak&#13;
</iruzkina></abisua><abisua id="n1"><data>12/04/2017 05:55:52 pm</data><mota>Istripua</mota><probintzia>Bizkaia</probintzia><hiria>irun</hiria><errepidea>n-1</errepidea><iruzkina>oso arazo larriak&#13;
</iruzkina></abisua></abisuak>
